{
  "schema_version": 1,
  "kind": "reference_fit_contract",
  "reference_id": "class-planck-primary-six-parameter-v1",
  "review_id": "2026-10-09-foundation-primary-source-claims",
  "status": "source_contract_reviewed",
  "paper_id": "arxiv:1807.06209v4",
  "source_sha256": {
    "html": "622d05fab48d935a2224afeade05b07393ec37e4e0554bb9c416f4298acb7bc0"
  },
  "locator": "Planck VI Secs.2.1,2.2,7.8; Planck V Secs.2.1,2.2.3,2.2.6,3.3.4,3.5.2,4; pinned CLASS and official clik callers.",
  "conditioning": "New uniform-H0, effective thermal CLASS/BBN2017/HyRec2020/HMcode2016 reference with released primary Commander+SimAll+Plik-lite. All six cosmological coordinates and shared calibration vary. This is not the prior, full Plik nuisance model or reconstructed-lensing target of Planck Table2.",
  "parameters": [
    {
      "name": "omega_b",
      "role": "cosmological",
      "unit": "dimensionless",
      "transform": "CLASS omega_b identity",
      "prior": {
        "kind": "uniform",
        "lower": 0.01,
        "upper": 0.035,
        "measure": "domega_b",
        "source_role": "Project choice within the BBN2017 grid"
      }
    },
    {
      "name": "omega_cdm",
      "role": "cosmological",
      "unit": "dimensionless",
      "transform": "CLASS omega_cdm identity",
      "prior": {
        "kind": "uniform",
        "lower": 0.05,
        "upper": 0.25,
        "measure": "domega_cdm",
        "source_role": "Project choice"
      }
    },
    {
      "name": "H0",
      "role": "cosmological",
      "unit": "km s^-1 Mpc^-1",
      "transform": "CLASS H0 identity",
      "prior": {
        "kind": "uniform",
        "lower": 40,
        "upper": 100,
        "measure": "dH0",
        "source_role": "Project choice: flat dH0, not flat dtheta_MC"
      }
    },
    {
      "name": "logA",
      "role": "cosmological",
      "unit": "dimensionless",
      "transform": "CLASS A_s=exp(logA)*1e-10",
      "prior": {
        "kind": "uniform",
        "lower": 1.61,
        "upper": 3.91,
        "measure": "dlogA",
        "source_role": "Planck VI Sec2.1 supplies this amplitude range; natural-log coordinate retained"
      }
    },
    {
      "name": "n_s",
      "role": "cosmological",
      "unit": "dimensionless",
      "transform": "CLASS n_s identity",
      "prior": {
        "kind": "uniform",
        "lower": 0.8,
        "upper": 1.2,
        "measure": "dn_s",
        "source_role": "Project choice"
      }
    },
    {
      "name": "tau_reio",
      "role": "cosmological",
      "unit": "dimensionless",
      "transform": "CLASS tau_reio identity; derive z_reio at each state",
      "prior": {
        "kind": "uniform",
        "lower": 0.01,
        "upper": 0.14,
        "measure": "dtau_reio",
        "source_role": "Project choice; not a prior inferred from the SimAll simulation ensemble"
      }
    },
    {
      "name": "A_planck",
      "role": "calibration",
      "unit": "dimensionless",
      "transform": "Official clik A_planck=y_P map calibration; theory divided by A_planck^2",
      "prior": {
        "kind": "truncated_gaussian",
        "lower": 0.9,
        "upper": 1.1,
        "mean": 1,
        "sigma": 0.0025,
        "measure": "dA_planck",
        "source_role": "Planck V Eq39 Gaussian; finite truncation bounds are a project choice"
      }
    }
  ],
  "model": {
    "gravity": "General relativity",
    "geometry": "Flat FLRW; explicit nonnegative-Lambda physical support",
    "components": [
      "Baryons",
      "Cold dark matter",
      "Photons",
      "Massless radiation N_ur=2.0327983725164924",
      "One effective FD massive neutrino of 0.06eV",
      "Lambda derived by closure using all actual densities"
    ],
    "primordial": "Adiabatic scalar power law, pivot0.05Mpc^-1; zero running and tensors",
    "thermal": "T_CMB=2.7255K; FD neutrino/antineutrino pair, native g=2/CLASS deg_ncdm=1, T_ncdm/T_CMB=0.71611, zero chemical potential; total early Neff=3.046",
    "helium": "YHe=BBN with explicit sBBN_2017.dat; derive mass fraction at each state",
    "reionization": "reio_camb: varied tau, exponent1.5, width0.5; second helium transition at z3.5 with width0.5",
    "recombination": "CLASS HyRec2020; explicit implementation choice for this new reference"
  },
  "implementation": {
    "repository": "https://github.com/lesgourg/class_public",
    "revision": "0ceb7a9a4c1e444ef5d5d56a8328a0640be91b18",
    "archive_sha256": "443a8b7c38b84cc8cfbb0dec907f1b618199e79df8d141dc3237b9a5185fb856",
    "source_assets": [
      {
        "id": "class-explanatory",
        "url": "https://raw.githubusercontent.com/lesgourg/class_public/0ceb7a9a4c1e444ef5d5d56a8328a0640be91b18/explanatory.ini",
        "sha256": "49fd6355685adc11dca2f406e23a6535b973e708efe9d3820f3aad46fdd061df",
        "role": "configuration",
        "conditioning": "Species, YHe, recombination, reio_camb, pivot and HMcode2016 options"
      },
      {
        "id": "class-input",
        "url": "https://raw.githubusercontent.com/lesgourg/class_public/0ceb7a9a4c1e444ef5d5d56a8328a0640be91b18/source/input.c",
        "sha256": "78326f1f557b22491655f0437aa1eb94f152d6c24c896ebde9eccfeebecbe463",
        "role": "parameter_mapping",
        "conditioning": "input_read_parameters_species; input_read_parameters_nonlinear; default_params"
      },
      {
        "id": "class-background",
        "url": "https://raw.githubusercontent.com/lesgourg/class_public/0ceb7a9a4c1e444ef5d5d56a8328a0640be91b18/source/background.c",
        "sha256": "00275b2c1e864571353745932384aeaa4fb7bf982e786d1aeb9a272cbf3b79df",
        "role": "species_density",
        "conditioning": "background_ncdm_init and background_solve Neff definition"
      },
      {
        "id": "class-thermodynamics",
        "url": "https://raw.githubusercontent.com/lesgourg/class_public/0ceb7a9a4c1e444ef5d5d56a8328a0640be91b18/source/thermodynamics.c",
        "sha256": "ce2d8e0b490106b002a3fb62561948ded4239db5109efea0ec2d297d458816ce",
        "role": "BBN_interpolation",
        "conditioning": "thermodynamics_helium_from_bbn; thermodynamics_init YHe mass-fraction conversion"
      },
      {
        "id": "class-precisions",
        "url": "https://raw.githubusercontent.com/lesgourg/class_public/0ceb7a9a4c1e444ef5d5d56a8328a0640be91b18/include/precisions.h",
        "sha256": "962fb9d95118b223b67abf36f9d1a1666408b377d9d0fd2fe5ddf60d20440bea",
        "role": "configuration",
        "conditioning": "sBBN_file default is2025 and must be overridden"
      },
      {
        "id": "class-bbn-2017",
        "url": "https://raw.githubusercontent.com/lesgourg/class_public/0ceb7a9a4c1e444ef5d5d56a8328a0640be91b18/external/bbn/sBBN_2017.dat",
        "sha256": "b72607a3a2f9134130cb2c09c0140d4f68c5916962e83fc6740a664bd5b69ea5",
        "role": "BBN_table",
        "conditioning": "Complete header, grid axes and table format; PArthENoPE1.2/neutron880.2s"
      },
      {
        "id": "clik-lklbs",
        "url": "https://pla.esac.esa.int/pla/aio/product-action?COSMOLOGY.FILE_ID=COM_Likelihood_Code-v3.0_R3.01.tar.gz#src/lklbs.c",
        "sha256": "81e595932c33553ea7fd913dcb0f858123923876ed42d668a6c8b823cb28fd52",
        "role": "official_likelihood_source",
        "conditioning": "lklbs_get_cls: calibration1/A_planck^2 on theory; cmblkl_select_cls"
      },
      {
        "id": "clik-helper",
        "url": "https://pla.esac.esa.int/pla/aio/product-action?COSMOLOGY.FILE_ID=COM_Likelihood_Code-v3.0_R3.01.tar.gz#src/clik_helper.c",
        "sha256": "301b457a7c988818a508c4ebee57ebc83a53d7f338baf2947725773d9d227851",
        "role": "official_likelihood_source",
        "conditioning": "free_calib metadata creates calibration name and index"
      },
      {
        "id": "clik-cmbonly-c",
        "url": "https://pla.esac.esa.int/pla/aio/product-action?COSMOLOGY.FILE_ID=COM_Likelihood_Code-v3.0_R3.01.tar.gz#src/cmbonly/clik_cmbonly.c",
        "sha256": "e288e7a3bc8008cf09ad23d69c010b93f0d4e74cabad5c87c5a89a9e4b245be4",
        "role": "official_likelihood_source",
        "conditioning": "xnames_def A_planck; clik_plik_cmbonly_init"
      },
      {
        "id": "clik-cmbonly-wrapper",
        "url": "https://pla.esac.esa.int/pla/aio/product-action?COSMOLOGY.FILE_ID=COM_Likelihood_Code-v3.0_R3.01.tar.gz#src/cmbonly/clik_cmbonly.f90",
        "sha256": "aadf73644f96315ced77d7a38217914c5f58d197f9438388aa497dd209e0695c",
        "role": "official_likelihood_source",
        "conditioning": "plik_cmbonly_extra_LKL: spectral TT/EE/TE blocks then calPlanck"
      },
      {
        "id": "clik-cmbonly-likelihood",
        "url": "https://pla.esac.esa.int/pla/aio/product-action?COSMOLOGY.FILE_ID=COM_Likelihood_Code-v3.0_R3.01.tar.gz#src/cmbonly/plik_cmbonly.f90",
        "sha256": "70630d03e5aae7ab24a08424136043e4ce95967eb75e8212db7462dc15665d6d",
        "role": "official_likelihood_source",
        "conditioning": "calc_like_cmbonly: binned model/calPlanck^2; X_data-X_model; half quadratic"
      },
      {
        "id": "clik-simall",
        "url": "https://pla.esac.esa.int/pla/aio/product-action?COSMOLOGY.FILE_ID=COM_Likelihood_Code-v3.0_R3.01.tar.gz#src/simall/clik_simall.c",
        "sha256": "624ffcf6cf8fb86a3cf755c02e119cfc76ce2415229d3c91177cadb2fc381393",
        "role": "official_likelihood_source",
        "conditioning": "simall_lkl: calibrated Dl/step finite support, integer table lookup"
      },
      {
        "id": "commander_TT-metadata",
        "url": "https://pla.esac.esa.int/pla/aio/product-action?COSMOLOGY.FILE_ID=COM_Likelihood_Data-baseline_R3.00.tar.gz#baseline/plc_3.0/low_l/commander/commander_dx12_v3_2_29.clik/clik/lkl_0/_mdb",
        "sha256": "8055330eefeefb8c31d07fe214029ece36f6893889d7641bf791f09fb31a3334",
        "role": "official_product_metadata",